{
  "schema_version": "entity.v0.1",
  "id": "ENTITY-MES-ERESKIGALA",
  "canonical_name": "Ereškigala",
  "names": [
    {
      "value": "Erec-ki-gala",
      "language": "Sumerian",
      "script": null
    }
  ],
  "aliases": [
    "Ereshkigal",
    "Ereškigal"
  ],
  "entity_type": "deity",
  "traditions": [
    "Sumerian literary and religious tradition"
  ],
  "roles": [
    "mistress/queen of the underworld in ETCSL 1.4.1",
    "sister of Inana in the narrative"
  ],
  "source_basis": [
    "SOURCE-ETCSL-INANA-DESCENT"
  ],
  "status": "reviewed",
  "confidence": 0.97,
  "notes": "Canonical spelling normalized while retaining the ETCSL transliteration as a source-form name.",
  "metadata": {
    "created_at": "2026-09-07T18:26:10Z",
    "updated_at": "2026-09-07T18:26:10Z"
  }
}
