{
  "schema_version": "entity.v0.1",
  "id": "ENTITY-MES-NINCUBURA",
  "canonical_name": "Ninšubur",
  "names": [
    {
      "value": "Nincubura",
      "language": "Sumerian",
      "script": null
    }
  ],
  "aliases": [
    "Ninshubur",
    "Ninšubur"
  ],
  "entity_type": "deity_or_divine_attendant",
  "traditions": [
    "Sumerian literary and religious tradition"
  ],
  "roles": [
    "minister and escort of Inana in ETCSL 1.4.1",
    "performs lament and petitions other deities"
  ],
  "source_basis": [
    "SOURCE-ETCSL-INANA-DESCENT"
  ],
  "status": "reviewed",
  "confidence": 0.96,
  "notes": "ETCSL translation uses the form Nincubura; normalized display name is Ninšubur.",
  "metadata": {
    "created_at": "2026-09-07T18:26:10Z",
    "updated_at": "2026-09-07T18:26:10Z"
  }
}
