{
  "schema_version": "entity.v0.1",
  "id": "ENTITY-MES-DUMUZID",
  "canonical_name": "Dumuzid",
  "names": [
    {
      "value": "Dumuzid",
      "language": "Sumerian",
      "script": null
    }
  ],
  "aliases": [
    "Dumuzi",
    "Tammuz (later Akkadian/Semitic form)"
  ],
  "entity_type": "deity",
  "traditions": [
    "Sumerian literary and religious tradition"
  ],
  "roles": [
    "husband of Inana in later section of ETCSL 1.4.1",
    "selected as substitute in the narrative"
  ],
  "source_basis": [
    "SOURCE-ETCSL-INANA-DESCENT"
  ],
  "status": "reviewed",
  "confidence": 0.97,
  "notes": "Later linguistic/traditional forms should be modeled through explicit relations rather than treated as identical without qualification.",
  "metadata": {
    "created_at": "2026-09-07T18:26:10Z",
    "updated_at": "2026-09-07T18:26:10Z"
  }
}
