{
  "schema_version": "entity.v0.1",
  "id": "ENTITY-MES-NETI",
  "canonical_name": "Neti",
  "names": [
    {
      "value": "Neti",
      "language": "Sumerian",
      "script": null
    }
  ],
  "aliases": [],
  "entity_type": "underworld_gatekeeper",
  "traditions": [
    "Sumerian literary tradition"
  ],
  "roles": [
    "chief doorman of the underworld in ETCSL 1.4.1"
  ],
  "source_basis": [
    "SOURCE-ETCSL-INANA-DESCENT"
  ],
  "status": "reviewed",
  "confidence": 0.97,
  "notes": null,
  "metadata": {
    "created_at": "2026-09-07T18:26:10Z",
    "updated_at": "2026-09-07T18:26:10Z"
  }
}
